auction_number;lot_number;contract_number;date_show;date_hide;date_start;date_stop;title;short_desc;desc;price1;price2;price3;img;img;img;img;img;img;img;img;img;img;img;img;img;img;img
5;1002680;;"2012-10-10 11:05:00";"2012-04-01 22:48:00";"2012-11-23 14:00:00";"2012-11-23 18:00:00";"Лот 510. Шпага прусская офицерская середины XIX в.";;"Сталь, латунь, серебро; ковка, литье, травление, золочение. Общая длина 997 мм, длина клинка 813 мм, ширина 21,5 мм. Клинок с обеих сторон по всей длине украшен травленым растительным орнаментом, изображением трофеев. На пяте - буквы С Е Н. Рукоять крупная, исполнена на высоком художественном уровне. Шпага безусловно изготовлена по индивидуальному заказу богатого офицера. На головке рукояти - изображение гранаты, указывающее на род службы заказчика. На основании экспертного заключения А.Н.Кулинского шпага имеет историко- культурную ценность.";1000;1300;;5_510_1.jpg;5_510_2.jpg;5_510_3.jpg;5_510_4.jpg;5_510_5.jpg;5_510_6.jpg;5_510_7.jpg;;;;;;;
5;1002681;;"2012-10-10 11:05:00";"2012-04-01 22:48:00";"2012-11-23 14:00:00";"2012-11-23 18:00:00";"Лот 511. Сабля европейская первой четверти XIX в.";;"Булатная сталь, латунь, кость, дерево, кожа; ковка, литье, гравировка, золочение. Общая длина 899 мм, длина клинка 765 мм, ширина 29,5 мм. Типичная европейская сабля периода наполеоновских войн, т.н. мамлюкского типа. После знаменитой битвы у пирамид офицеры французской армии стали заказывать оружейникам сабли восточного типа. Особым шиком было использование трофейного восточного клинка (как в этом случае). Великолепный клинок редкого (и дорогого) сорта булата - кара-харасан одет в ножны с «секретом». Съемные обоймицы прибора позволяют менять подвеску с «сабельной» на «шашечную» (с кольцами на выгнутой кромке ножен). Сделано это из практических соображений, что вкупе с общим износом сабли указывает на ее длительное использование в боевых целях. Прекрасный образец «наполеоники». Эксперт А.Н.Кулинский отмечает большую историко-культурную ценность сабли.";4000;5000;;5_511_1.jpg;5_511_2.jpg;5_511_3.jpg;5_511_4.jpg;5_511_5.jpg;5_511_6.jpg;;;;;;;;
5;1002682;;"2012-10-10 11:05:00";"2012-04-01 22:48:00";"2012-11-23 14:00:00";"2012-11-23 18:00:00";"Лот 512. Сабля австрийская или венгерская(?) офицерская 1-й половины XIX в.";;"Дамасская сталь, рог, дерево; ковка. Общая длина 831 мм, длина клинка 734 мм, ширина клинка 29 мм. Клинок большой кривизны, дамасской стали с ярко выраженным узором. Концы крестовины выполнены в виде костей. Сабля изготовлена по индивидуальному заказу, клейма и надписи отсутствуют, что затрудняет точную атрибуцию. Интересный, необычный предмет. На основании экспертного заключения А.Н.Кулинского сабля имеет историко-культурную ценность.";1000;1300;;5_512_1.jpg;5_512_2.jpg;5_512_3.jpg;5_512_4.jpg;5_512_5.jpg;;;;;;;;;
5;1002683;;"2012-10-10 11:05:00";"2012-04-01 22:48:00";"2012-11-23 14:00:00";"2012-11-23 18:00:00";"Лот 513. Кирасса европейская, возможно, Франция. XVIII в.";;"Сталь, латунь, кожа; ковка, чеканка, литье. Высота 39 см, ширина 37 см, глубина 16,5 см. Передняя часть кирасы XVIII в. Подобные кирасы широко применялись воюющими европейскими странами также и во время наполеоновских войн.";1000;1300;;5_513_1.jpg;5_513_2.jpg;;;;;;;;;;;;
5;1002684;;"2012-10-10 11:05:00";"2012-04-01 22:48:00";"2012-11-23 14:00:00";"2012-11-23 18:00:00";"Лот 514. Пернач восточно-европейский XVIII в.";;"Сталь; ковка, литье. Общая длина 603 мм, высота перьев 77 мм, толщина рукояти 20-22 мм. Боевая часть образована 11-ю закругленными перьями. Рукоять стальная полая, со слабовыраженными завитками по всей длине. В XVIII в. такие перначи использовались в качестве рангового знака различия командного состава, в основном в кавалерии. Редкий предмет хорошего качества. Экспертное заключение А.Н.Кулинского. Историко-культурная ценность.";2000;2500;;5_514_1.jpg;5_514_2.jpg;;;;;;;;;;;;
5;1002685;;"2012-10-10 11:05:00";"2012-04-01 22:48:00";"2012-11-23 14:00:00";"2012-11-23 18:00:00";"Лот 515. Русский пехотный тесак образца 1807 г.";;"Сталь, латунь; ковка, литье. Общая длина 795 мм, длина клинка 654 мм, ширина 34 мм. Классический тесак русской пехоты Отечественной войны 1812 г. В 1817 г. был снят с вооружения, поэтому сохранился только в крупнейших музейных коллекциях. Данный экземпляр в 1991 г. был приобретен в антикварном магазине г. Лейпцига (см. Битва народов под Лейпцигом 1814 г.). Согласно экспертному заключению А.Н.Кулинского, данный тесак относится к предметам, имеющим историко-культурную ценность.";1000;1300;;5_515_1.jpg;5_515_2.jpg;;;;;;;;;;;;
5;1002686;;"2012-10-10 11:05:00";"2012-04-01 22:48:00";"2012-11-23 14:00:00";"2012-11-23 18:00:00";"Лот 516. Топорик церемониальный. Италия. Середина XVII в.";;"Сталь, дерево; ковка, резьба, чеканка, гравировка. Общая длина 54 см, длина рукояти 50,5 см, длина лезвия топора 12,6 см. Топорик декорирован несколькими сюжетами в виде гротескных фигур, вырезанных и вычеканерных в высоком рельефе. Очень похожий по сюжету и технике исполнения топорик хранится в известном собрании Дж.Ротшильда (Claude Blair. Arms, Armour and Basemetalwork. London 1974 cat. N95). Великолепный образец ударного оружия, принадлежавший состоятельному человеку. Произведение итальянского оружейного искусства XVII в. Экспертное заключение Ю.Г.Ефимова (Эрмитаж).";2000;2500;;5_516_1.jpg;5_516_2.jpg;5_516_3.jpg;5_516_4.jpg;;;;;;;;;;
5;1002687;;"2012-10-10 11:05:00";"2012-04-01 22:48:00";"2012-11-23 14:00:00";"2012-11-23 18:00:00";"Лот 517. Шлем морион. Германия. XVI в.";;"Сталь, кожа, латунь; ковка, чеканка, литье. Высота с гребнем 268 мм, внутренние размеры 230х180 мм. Классический морион, использовавшийся на европейских полях сражений с середины XVI в. до конца XVII в. Традиционная форма и дизайн (вычеканенный с обеих сторон стилизованный цветок лилии на стебле), т.н. черно-белый морион. Небольшая деформация гребня указывает на применение шлема в боях. Экспертное заключение Ю.Г.Ефимова (Эрмитаж).";2000;2500;;5_517_1.jpg;5_517_2.jpg;5_517_3.jpg;5_517_4.jpg;;;;;;;;;;
5;1002688;;"2012-10-10 11:05:00";"2012-04-01 22:48:00";"2012-11-23 14:00:00";"2012-11-23 18:00:00";"Лот 518. Меч правосудия (меч палача). Германия. cередина XVI в.";;"Сталь, дерево, латунь; ковка, таушировка, гравировка. На клинке с обеих сторон в долах контурными готическими буквами выполнена надпись AGLA. На крестовине с правой стороны высечено изображение косого (т.н. Андреевского) креста. Общая длина 1059 мм, длина клинка 848 мм, ширина клинка у основания 62,8 мм, у окончания 43 мм. Данные мечи использовались как символы судебной власти, но, как правило, выступали в качестве орудия казни. Особенно традиция обезглавливания осужденных была характерна для Германии. Аналогичные мечи можно увидеть в Историческом музее Дрездена и Музее города в Кельне. Надпись на клинке может трактоваться как надпись-оберег, выполненная в традициях каббалы на старом иврите. Сочетание начальных букв первых четырех слов Attax Gibbor Leolan Adonai благословения «Esreh Schemoneh» можно перевести как «Могуч и искусен Господь всегда». Данная надпись использовалась в качестве оберега от болезней и злых влияний. В то же время данная надпись по своей стилистике и технике исполнения соответствует надписям на клинках мечей, датируемых 1300-1330 гг. В этом случае надпись может читаться как латинское изречение A(alme)G(genitricis)LA(laudis) - Божьей Матери Слава. Клеймо в виде Андреевского креста может быть определено как надпись-сигла, раскрывающаяся как «Христос». Вследствие этого можно предположить, что клинок меча ранее являлся клинком меча начала 14 века по классификации Э.Окшотта - меч типа ХIII a-Grete Swerdes (великие мечи). Изображения таких мечей встречаются на средневековых миниатюрах. Экспертные заключения - профессор А.Н.Кирпичников (Институт истории материальной культуры РАН), Д.С.Коровкин (С-Петербургский Университет МВД России, кафедра криминалистических экспертиз и исследований). Провенанс: коллекция замка Hessen Solms-Laubach Германия.";5000;6000;;5_518_1.jpg;5_518_2.jpg;5_518_3.jpg;5_518_4.jpg;;;;;;;;;;
